[
  {
    "id": "militia",
    "name": "Militia",
    "supply_cost": 20,
    "hp": 70,
    "damage": 11,
    "attack_period_s": 0.8,
    "windup_s": 0.2,
    "range_m": 0.6,
    "move_speed_m_s": 1.25,
    "flat_damage_reduction": 0,
    "splash_radius_m": 0,
    "base_damage": 11,
    "projectile_speed_m_s": 0,
    "collision_half_width_m": 0.25,
    "combat_role": "melee",
    "unlocked_initially": true,
    "unlock_medals": 0,
    "rig": "biped",
    "master_asset_id": "unit_militia",
    "tuning_status": "LOCKED_B001_NOT_GAMEPLAY_VALIDATED",
    "attack_period_ticks": 16,
    "windup_ticks": 4
  },
  {
    "id": "shieldguard",
    "name": "Shieldguard",
    "supply_cost": 45,
    "hp": 240,
    "damage": 10,
    "attack_period_s": 1.1,
    "windup_s": 0.25,
    "range_m": 0.65,
    "move_speed_m_s": 0.9,
    "flat_damage_reduction": 3,
    "splash_radius_m": 0,
    "base_damage": 10,
    "projectile_speed_m_s": 0,
    "collision_half_width_m": 0.25,
    "combat_role": "melee",
    "unlocked_initially": true,
    "unlock_medals": 0,
    "rig": "biped",
    "master_asset_id": "unit_shieldguard",
    "tuning_status": "LOCKED_B001_NOT_GAMEPLAY_VALIDATED",
    "attack_period_ticks": 22,
    "windup_ticks": 5
  },
  {
    "id": "crossbowman",
    "name": "Crossbowman",
    "supply_cost": 50,
    "hp": 75,
    "damage": 50,
    "attack_period_s": 1.8,
    "windup_s": 0.35,
    "range_m": 5.5,
    "move_speed_m_s": 1.05,
    "flat_damage_reduction": 0,
    "splash_radius_m": 0,
    "base_damage": 25,
    "projectile_speed_m_s": 12,
    "collision_half_width_m": 0.25,
    "combat_role": "ranged",
    "unlocked_initially": true,
    "unlock_medals": 0,
    "rig": "biped",
    "master_asset_id": "unit_crossbowman",
    "tuning_status": "LOCKED_B001_NOT_GAMEPLAY_VALIDATED",
    "attack_period_ticks": 36,
    "windup_ticks": 7
  },
  {
    "id": "grenadier",
    "name": "Grenadier",
    "supply_cost": 65,
    "hp": 90,
    "damage": 36,
    "attack_period_s": 2.4,
    "windup_s": 0.5,
    "range_m": 4.6,
    "move_speed_m_s": 0.95,
    "flat_damage_reduction": 0,
    "splash_radius_m": 1.0,
    "base_damage": 18,
    "projectile_speed_m_s": 8,
    "collision_half_width_m": 0.25,
    "combat_role": "ranged",
    "unlocked_initially": true,
    "unlock_medals": 0,
    "rig": "biped",
    "master_asset_id": "unit_grenadier",
    "tuning_status": "LOCKED_B001_NOT_GAMEPLAY_VALIDATED",
    "attack_period_ticks": 48,
    "windup_ticks": 10
  },
  {
    "id": "brute",
    "name": "Brute",
    "supply_cost": 110,
    "hp": 480,
    "damage": 65,
    "attack_period_s": 1.6,
    "windup_s": 0.45,
    "range_m": 0.85,
    "move_speed_m_s": 0.72,
    "flat_damage_reduction": 0,
    "splash_radius_m": 0,
    "base_damage": 65,
    "projectile_speed_m_s": 0,
    "collision_half_width_m": 0.45,
    "combat_role": "melee",
    "unlocked_initially": false,
    "unlock_medals": 40,
    "rig": "biped",
    "master_asset_id": "unit_brute",
    "tuning_status": "LOCKED_B001_NOT_GAMEPLAY_VALIDATED",
    "attack_period_ticks": 32,
    "windup_ticks": 9
  },
  {
    "id": "ram",
    "name": "Battering Ram",
    "supply_cost": 100,
    "hp": 420,
    "damage": 14,
    "attack_period_s": 2,
    "windup_s": 0.55,
    "range_m": 0.85,
    "move_speed_m_s": 0.8,
    "flat_damage_reduction": 2,
    "splash_radius_m": 0,
    "base_damage": 150,
    "projectile_speed_m_s": 0,
    "collision_half_width_m": 0.45,
    "combat_role": "melee",
    "unlocked_initially": false,
    "unlock_medals": 80,
    "rig": "ram",
    "master_asset_id": "unit_ram",
    "tuning_status": "LOCKED_B001_NOT_GAMEPLAY_VALIDATED",
    "attack_period_ticks": 40,
    "windup_ticks": 11
  }
]
